{
  "schemaVersion": 1,
  "gate": "R1",
  "versionManifest": "package.json",
  "cliVersionManifest": "apps/cli/package.json",
  "dependencyLock": "package-lock.json",
  "traceability": {
    "buildPlan": "docs/BUILD_PLAN.md",
    "operationsTestPlan": "docs/OPERATIONS_TEST_PLAN.md"
  },
  "commands": [
    {
      "id": "dependency-install",
      "executable": "npm",
      "args": ["ci", "--ignore-scripts", "--silent", "--no-audit", "--no-fund"],
      "timeoutMs": 900000
    },
    {
      "id": "dependency-tree",
      "executable": "npm",
      "args": ["ls", "--all", "--json"],
      "timeoutMs": 300000
    },
    {
      "id": "static",
      "executable": "npm",
      "args": ["run", "static"],
      "timeoutMs": 900000
    },
    {
      "id": "unit-contract",
      "executable": "npm",
      "args": ["run", "test:unit"],
      "timeoutMs": 1200000
    },
    {
      "id": "pty-local",
      "executable": "npm",
      "args": ["run", "test:pty"],
      "timeoutMs": 900000
    },
    {
      "id": "package-smoke",
      "executable": "npm",
      "args": ["run", "test:package"],
      "timeoutMs": 900000
    },
    {
      "id": "gate-b",
      "executable": "npm",
      "args": ["run", "test:gate:b"],
      "timeoutMs": 3600000
    }
  ],
  "requirements": [
    {
      "requirementId": "FR-CLI-001",
      "terminalGate": "R1",
      "status": "partial",
      "ticketIds": ["R1.10", "R1.12"],
      "testIds": ["E2E-001"],
      "commandIds": ["package-smoke"],
      "note": "The installed private candidate enters the same synthetic coding session under a real PTY; R1 acceptance still requires reviewed hosted evidence."
    },
    {
      "requirementId": "FR-CLI-005",
      "terminalGate": "R1",
      "status": "partial",
      "ticketIds": ["R1.10"],
      "testIds": ["UNIT-001"],
      "commandIds": ["unit-contract"],
      "note": "R1 closes the implemented prompt-versus-reserved-command paths without claiming the later complete administrative command tree."
    },
    {
      "requirementId": "FR-AGT-002",
      "terminalGate": "R3",
      "status": "partial",
      "ticketIds": ["R1.02"],
      "testIds": ["UNIT-004"],
      "commandIds": ["unit-contract"],
      "note": "R1 implements and prefix-replays the ephemeral legal turn state model; R3 owns durable replay and recovery completion."
    },
    {
      "requirementId": "FR-AUTO-004",
      "terminalGate": "R7",
      "status": "partial",
      "ticketIds": ["R0.06"],
      "testIds": ["TERM-012"],
      "commandIds": ["package-smoke"],
      "note": "The installed R1 candidate preserves ANSI-free implemented headless output; R7 owns the stable automation contract and full operating-system matrix."
    },
    {
      "requirementId": "NFR-MAINT-001",
      "terminalGate": "R12",
      "status": "partial",
      "ticketIds": ["R1.01", "R1.10"],
      "testIds": ["SEC-018"],
      "commandIds": ["static"],
      "note": "R1 preserves terminal, application, agent, provider, tool, and state package boundaries; R12 closes the requirement across the selected editor client."
    }
  ],
  "fixtures": [
    {
      "id": "r1-pty-driver",
      "path": "tests/pty/robin_pty_driver.py",
      "schemaVersion": 1
    }
  ],
  "artifacts": [
    {
      "id": "cli-package-manifest",
      "path": "apps/cli/package.json",
      "mediaType": "application/json"
    },
    {
      "id": "cli-tarball-inventory",
      "path": "evidence/inventory/r1-cli-tarball-v1.json",
      "mediaType": "application/json"
    },
    {
      "id": "terminal-compatibility",
      "path": "docs/TERMINAL_COMPATIBILITY.md",
      "mediaType": "text/markdown"
    },
    {
      "id": "application-event-contract",
      "path": "packages/robin-application/src/application-event.ts",
      "mediaType": "text/typescript"
    },
    {
      "id": "turn-state-reducer",
      "path": "packages/robin-session/src/turn-state.ts",
      "mediaType": "text/typescript"
    }
  ],
  "supportedClaims": [
    "This manifest records local deterministic R1 candidate commands at the tested commit; it does not by itself establish R1 acceptance.",
    "The same provider-neutral application and turn coordinator power the implemented raw, flat, text, JSON, and streaming-JSON candidate surfaces.",
    "The local real-PTY suite verifies two synthetic coding-tool calls, a dependent follow-up, queue promotion, cancellation escalation, resize, inert paste, failure cleanup, and terminal restoration.",
    "The private candidate tarball matches the reviewed 59-file inventory and passes isolated install, installed raw-PTY execution, and offline uninstall smoke."
  ],
  "deferredClaims": [
    "R1 acceptance, hosted Linux/macOS results, branch protection, and mainline merge identity are external records not established by this local manifest.",
    "Physical repository reads or writes, command execution, verification processes, Git operations, worktrees, and sandbox enforcement are not established by R1.",
    "A production model provider, arbitrary provider or agent compatibility, API-key onboarding, credential storage, or network access is not established by R1.",
    "Durable sessions, continuation, resume, crash recovery, background supervision, and editor clients are not established by R1.",
    "A public package publication, supported installation channel, upgrade, rollback, migration, or production uninstall guarantee is not established by R1."
  ],
  "knownLimitations": [
    {
      "id": "tested-commit-semantics",
      "summary": "The commit field identifies the clean source commit tested before the generated manifest file is written.",
      "impact": "A later manifest commit intentionally points to its tested source parent and never claims to hash itself."
    },
    {
      "id": "unaccepted-r0-prerequisite",
      "summary": "R0 remains an unmerged prerequisite while this R1 candidate is stacked on its candidate commit.",
      "impact": "R1 cannot be accepted until R0 is accepted on mainline and R1 is rebased or otherwise proven against that baseline."
    },
    {
      "id": "single-host-capture",
      "summary": "The generated local manifest records one host environment only.",
      "impact": "It does not replace the separately required hosted Linux and macOS PTY and package evidence."
    },
    {
      "id": "synthetic-fixture-only",
      "summary": "The R1 provider and both coding tools operate only on deterministic in-memory fixture data.",
      "impact": "No physical checkout, real provider, API key, process, Git repository, or persistent user data is exercised."
    },
    {
      "id": "experimental-machine-contract",
      "summary": "The JSON and streaming-JSON candidate envelopes explicitly declare experimental stability.",
      "impact": "R7, not R1, owns stable headless schemas, compatibility, and multi-provider conformance."
    },
    {
      "id": "python-pty-harness",
      "summary": "The R1 process-level PTY harness uses the operating system Python 3 standard library.",
      "impact": "Python is a contributor and CI test dependency for this candidate, not a runtime dependency of the packed Robin CLI."
    },
    {
      "id": "ephemeral-package-archive",
      "summary": "Package smoke verifies the temporary gzip archive, canonical tar, exact file hashes and modes, npm integrity metadata, install, PTY execution, and uninstall before removing it.",
      "impact": "The inventory retains measured macOS-arm64 npm 10/11 and Linux-x64 npm 10 compression profiles, but the archive is not retained or signed; immutable release provenance remains R10 work."
    },
    {
      "id": "partial-requirement-evidence",
      "summary": "Evidence schema v1 records partial requirement progress only.",
      "impact": "No requirement is marked complete solely because the R1 candidate or this manifest exists."
    }
  ]
}
